{
  "$schema": "working/fleet-constraint-v2/constraint-migration-receipt.v1.schema.json",
  "receipt_meta": {
    "schema_version": 1,
    "receipt_id": "1182ded0-f8b6-4c8b-8bc1-78e0a810a862",
    "generated_at": "2026-09-13T21:17:53.239Z",
    "gate_stage": "G3",
    "program_gate_policy": "advisory"
  },
  "pin": {
    "methodology_pin": "48d1fbb+",
    "analyzer_build_identity": "pseudocode-analyzer/1.0.0+stdd@63bcaef",
    "manifest_entry_id": "fleet-1787495576-W-ext-1787495576-1-IMPL-NETIF_CLI"
  },
  "subject": {
    "sidecar_path": "../../test/1787495576/tied/implementation-decisions/IMPL-NETIF_CLI-pseudocode.md",
    "impl_token": "IMPL-NETIF_CLI",
    "input_identity": {
      "algorithm": "sha256",
      "hash": "58668d8d53191c71d29c87951de4eeeaf5e6199f0fdb8d8e447bf928c1b69b1b",
      "byte_length": 4332
    },
    "grammar_version": "pseudocode-grammar.v2",
    "annotation_profile": "header-only-v2"
  },
  "layer_a": {
    "applicable": true,
    "ok": true
  },
  "layer_b": {
    "ok": true,
    "validator_schema_version": "layer-b-pseudocode-validator.v1",
    "blocks_count": 3,
    "contract_precision": {
      "active_blocks_with_contract": 3,
      "active_blocks_missing_pre_or_post": 0,
      "active_blocks_missing_failure_modes": 0,
      "active_blocks_missing_data_transition": 0,
      "active_blocks_missing_termination": 0
    },
    "error_count": 0,
    "warning_count": 0
  },
  "layer_c": {
    "gate_mode": true,
    "typed_flow": true,
    "constraint_flow": true,
    "constraint_gate_errors_policy": "advisory",
    "ok": true,
    "analysis_truncated": false,
    "diagnostics_truncated": false,
    "error_count": 0,
    "warning_count": 0,
    "info_count": 0,
    "procedure_count": 3,
    "source_report_schema": "pseudocode-analysis-report.v1"
  },
  "constraint": {
    "ran": true,
    "procedures_analyzed": 3,
    "refinements_checked": 0,
    "refinements_proven": 0,
    "alias_mut_checked": 0,
    "alias_mut_violations": 0,
    "solver_truncated": false,
    "solver_truncation_cause": "none",
    "alias_analysis_truncated": false,
    "budget_exceeded": false,
    "constraint_diagnostics_truncated": false
  },
  "unknown_summary": {
    "unknown": 0,
    "truncated": 0,
    "unsupported": 14,
    "prose_only": 0,
    "budget_exceeded": 0
  },
  "constraint_gate_errors": [],
  "promotion_readiness": {
    "qualification_green": false,
    "f11_pass": false,
    "fp_within_threshold": false,
    "as_of_phase": "P4-E-fleet-g3"
  }
}
