{
  "$schema": "working/fleet-constraint-v2/constraint-migration-receipt.v1.schema.json",
  "receipt_meta": {
    "schema_version": 1,
    "receipt_id": "ad212dd9-a095-4496-9a4b-53eb2f6e40bb",
    "generated_at": "2026-09-12T15:02:43.324Z",
    "gate_stage": "G1",
    "program_gate_policy": "advisory"
  },
  "pin": {
    "methodology_pin": "48d1fbb+",
    "analyzer_build_identity": "pseudocode-analyzer/1.0.0+stdd@b568c98",
    "manifest_entry_id": "tier-a-1787691672-IMPL-NETWORK_LISTENER_COLLECTOR"
  },
  "subject": {
    "sidecar_path": "../../test/1787691672/tied/implementation-decisions/IMPL-NETWORK_LISTENER_COLLECTOR-pseudocode.md",
    "impl_token": "IMPL-NETWORK_LISTENER_COLLECTOR",
    "input_identity": {
      "algorithm": "sha256",
      "hash": "7ba6884cb64183f338d0110901f8b4a993ecd7b12204ddfea565bda525dc50e1",
      "byte_length": 879
    },
    "grammar_version": "pseudocode-grammar.v1",
    "annotation_profile": "legacy-v1"
  },
  "layer_a": {
    "applicable": false,
    "ok": true,
    "notes": "Layer A skipped for qualification harness receipt (read-only analyze)."
  },
  "layer_b": {
    "ok": true,
    "validator_schema_version": "layer-b-pseudocode-validator.v1",
    "blocks_count": 0,
    "contract_precision": {
      "active_blocks_with_contract": 0,
      "active_blocks_missing_pre_or_post": 0,
      "active_blocks_missing_failure_modes": 0,
      "active_blocks_missing_data_transition": 0,
      "active_blocks_missing_termination": 0
    },
    "error_count": 0,
    "warning_count": 0
  },
  "layer_c": {
    "gate_mode": true,
    "typed_flow": true,
    "constraint_flow": true,
    "constraint_gate_errors_policy": "advisory",
    "ok": true,
    "analysis_truncated": false,
    "diagnostics_truncated": false,
    "error_count": 0,
    "warning_count": 0,
    "info_count": 0,
    "procedure_count": 0,
    "source_report_schema": "pseudocode-analysis-report.v1"
  },
  "constraint": {
    "ran": true,
    "procedures_analyzed": 0,
    "refinements_checked": 0,
    "refinements_proven": 0,
    "alias_mut_checked": 0,
    "alias_mut_violations": 0,
    "solver_truncated": false,
    "solver_truncation_cause": "none",
    "alias_analysis_truncated": false,
    "budget_exceeded": false,
    "constraint_diagnostics_truncated": false
  },
  "unknown_summary": {
    "unknown": 0,
    "truncated": 0,
    "unsupported": 0,
    "prose_only": 0,
    "budget_exceeded": 0
  },
  "constraint_gate_errors": [],
  "promotion_readiness": {
    "qualification_green": true,
    "f11_pass": false,
    "fp_within_threshold": false,
    "as_of_phase": "P2-F-harness"
  }
}
