{
  "$schema": "working/fleet-constraint-v2/constraint-migration-receipt.v1.schema.json",
  "receipt_meta": {
    "schema_version": 1,
    "receipt_id": "adb6f72a-9750-49ef-b999-a9748563f5c7",
    "generated_at": "2026-09-12T15:02:44.551Z",
    "gate_stage": "G1",
    "program_gate_policy": "advisory"
  },
  "pin": {
    "methodology_pin": "48d1fbb+",
    "analyzer_build_identity": "pseudocode-analyzer/1.0.0+stdd@b568c98",
    "manifest_entry_id": "tier-b-stdd-IMPL-VOCABULARY_HTML_RENDERER"
  },
  "subject": {
    "sidecar_path": "tied/implementation-decisions/IMPL-VOCABULARY_HTML_RENDERER-pseudocode.md",
    "impl_token": "IMPL-VOCABULARY_HTML_RENDERER",
    "input_identity": {
      "algorithm": "sha256",
      "hash": "a5c72bb2548428f308d6b5133e2782f3c3da5e704a12e37d70378fbb9012c3e9",
      "byte_length": 1090
    },
    "grammar_version": "pseudocode-grammar.v1",
    "annotation_profile": "legacy-v1"
  },
  "layer_a": {
    "applicable": true,
    "ok": true
  },
  "layer_b": {
    "ok": true,
    "validator_schema_version": "layer-b-pseudocode-validator.v1",
    "blocks_count": 0,
    "contract_precision": {
      "active_blocks_with_contract": 0,
      "active_blocks_missing_pre_or_post": 0,
      "active_blocks_missing_failure_modes": 0,
      "active_blocks_missing_data_transition": 0,
      "active_blocks_missing_termination": 0
    },
    "error_count": 0,
    "warning_count": 0
  },
  "layer_c": {
    "gate_mode": true,
    "typed_flow": true,
    "constraint_flow": true,
    "constraint_gate_errors_policy": "advisory",
    "ok": true,
    "analysis_truncated": false,
    "diagnostics_truncated": false,
    "error_count": 0,
    "warning_count": 0,
    "info_count": 0,
    "procedure_count": 0,
    "source_report_schema": "pseudocode-analysis-report.v1"
  },
  "constraint": {
    "ran": true,
    "procedures_analyzed": 0,
    "refinements_checked": 0,
    "refinements_proven": 0,
    "alias_mut_checked": 0,
    "alias_mut_violations": 0,
    "solver_truncated": false,
    "solver_truncation_cause": "none",
    "alias_analysis_truncated": false,
    "budget_exceeded": false,
    "constraint_diagnostics_truncated": false
  },
  "unknown_summary": {
    "unknown": 0,
    "truncated": 0,
    "unsupported": 0,
    "prose_only": 0,
    "budget_exceeded": 0
  },
  "constraint_gate_errors": [],
  "promotion_readiness": {
    "qualification_green": true,
    "f11_pass": false,
    "fp_within_threshold": false,
    "as_of_phase": "P2-F-harness"
  }
}
